Station ID,Station Name,Domain,Centre,State,Country,Mode,Address,Address Link,View Details
4594,"National Load Despatch Centre, Grid Controller of India Limited",CSIS/IT,New Delhi,Delhi,India,Onsite,"B-9(1st and 2nd Floor), Qutab Industrial Area Katwaria Sarai, New Delhi - 110016","https://www.google.com/maps/search/B-9(1st+and+2nd+Floor),+Qutab+Industrial+Area+Katwaria+Sarai,+New+Delhi+-+110016",https://psms.bits-pilani.ac.in/stationpreference/student/stationdetails/4594/114356
6690,National Remote Sensing Centre,CSIS/IT,Hyderabad,Telangana,India,Onsite,"NRSC Balanagar, Hyderabad 500037 NRSC Balanagar, Hyderabad 500037","https://www.google.com/maps/search/NRSC+Balanagar,+Hyderabad+500037+NRSC+Balanagar,+Hyderabad+500037",https://psms.bits-pilani.ac.in/stationpreference/student/stationdetails/6690/114356
6759,National Stock Exchange of India Limited,Finance and Mgmt,Mumbai,Maharashtra,India,Onsite,"National Stock Exchange of India Limited (NSE) 10 th Floor, Adani Inspire, G Block,  BKC, Mumbai – 400051","https://www.google.com/maps/search/National+Stock+Exchange+of+India+Limited+(NSE)+10+th+Floor,+Adani+Inspire,+G+Block,++BKC,+Mumbai+–+400051",https://psms.bits-pilani.ac.in/stationpreference/student/stationdetails/6759/114356
8815,National Test House(SR),Finance and Mgmt,Chennai,Tamil Nadu,India,Onsite,"CSIR Road, Taramani, Chennai 600113 CSIR Road, Taramani, Chennai 600113","https://www.google.com/maps/search/CSIR+Road,+Taramani,+Chennai+600113+CSIR+Road,+Taramani,+Chennai+600113",https://psms.bits-pilani.ac.in/stationpreference/student/stationdetails/8815/114356
8505,NDR Warehousing,Mechanical,Goa,Goa,India,Onsite,NDR Warehousing NDR Warehousing,https://www.google.com/maps/search/NDR+Warehousing+NDR+Warehousing,https://psms.bits-pilani.ac.in/stationpreference/student/stationdetails/8505/114356
8649,Neovant Therapeutics Pvt Ltd,Health Care,Ahmedabad,Gujarat,India,Onsite,"Neovant Therapeutics Pvt. Ltd., B1-12, Galaxy Signature, Science City Road Sofa,  Ahmedabad, Gujarat-380060, India.","https://www.google.com/maps/search/Neovant+Therapeutics+Pvt.+Ltd.,+B1-12,+Galaxy+Signature,+Science+City+Road+Sofa,++Ahmedabad,+Gujarat-380060,+India.",https://psms.bits-pilani.ac.in/stationpreference/student/stationdetails/8649/114356
6985,"NERLDC- North Eastern Regional Load Despatch Center, Grid-India",Electronics,Guwahati,Assam,India,Onsite,"Shillong, Guwahati Shillong, Guwahati","https://www.google.com/maps/search/Shillong,+Guwahati+Shillong,+Guwahati",https://psms.bits-pilani.ac.in/stationpreference/student/stationdetails/6985/114356
8522,NeSL Asset Data Limited (NADL),Finance and Mgmt,Bengaluru,Karnataka,India,Online,"'A' Wing 5th Floor, “The Estate” Building 121, Dickenson Road, Bengaluru – 560 042 'A' Wing 5th Floor, “The Estate” Building 121, Dickenson Road, Bengaluru – 560 042","https://www.google.com/maps/search/'A'+Wing+5th+Floor,+“The+Estate”+Building+121,+Dickenson+Road,+Bengaluru+–+560+042+'A'+Wing+5th+Floor,+“The+Estate”+Building+121,+Dickenson+Road,+Bengaluru+–+560+042",https://psms.bits-pilani.ac.in/stationpreference/student/stationdetails/8522/114356
4603,NHPC Limited,Mechanical,Faridabad,Haryana,India,Onsite,"NHPC Office Complex, Sector-33 Faridabad, Haryana - 121003","https://www.google.com/maps/search/NHPC+Office+Complex,+Sector-33+Faridabad,+Haryana+-+121003",https://psms.bits-pilani.ac.in/stationpreference/student/stationdetails/4603/114356
8548,Nichebit Softech Pvt. Ltd.,CSIS/IT,Hyderabad,Telangana,India,Onsite,"Manjeera Trinity Corporate, 1101/A, JNTU - Hitech City Rd, Kukatpally Housing Board Colony, K P H B Phase 3, Kukatpally,  Hyderabad, Telangana 500072","https://www.google.com/maps/search/Manjeera+Trinity+Corporate,+1101/A,+JNTU+-+Hitech+City+Rd,+Kukatpally+Housing+Board+Colony,+K+P+H+B+Phase+3,+Kukatpally,++Hyderabad,+Telangana+500072",https://psms.bits-pilani.ac.in/stationpreference/student/stationdetails/8548/114356
4549,NICSI( National Informatics Centre services Inc.),CSIS/IT,Delhi,Delhi,India,Onsite,"NICSI ,  NBCC Tower, 15 Bhikaji Cama Place, New Delhi - 110066. NICSI ,  NBCC Tower, 15 Bhikaji Cama Place, New Delhi - 110066.","https://www.google.com/maps/search/NICSI+,++NBCC+Tower,+15+Bhikaji+Cama+Place,+New+Delhi+-+110066.+NICSI+,++NBCC+Tower,+15+Bhikaji+Cama+Place,+New+Delhi+-+110066.",https://psms.bits-pilani.ac.in/stationpreference/student/stationdetails/4549/114356
7040,Niftrix Technologies Private Limited,CSIS/IT,Bengaluru,Karnataka,India,Online,"3 rd Floor, Tejas Arcade, 528/A, 529/A - 9/1 – 1st Main Road, A Block, Subramanya Nagar, Ward No.9,  Bangalore 560010 Karnataka","https://www.google.com/maps/search/3+rd+Floor,+Tejas+Arcade,+528/A,+529/A+-+9/1+–+1st+Main+Road,+A+Block,+Subramanya+Nagar,+Ward+No.9,++Bangalore+560010+Karnataka",https://psms.bits-pilani.ac.in/stationpreference/student/stationdetails/7040/114356
8893,Nirmaan Organization,Health Care,Madhapur,Telangana,India,Onsite,"5th Floor, Trendz Spire, Backside Zudio, Kavuri Hills Madhapur-500081","https://www.google.com/maps/search/5th+Floor,+Trendz+Spire,+Backside+Zudio,+Kavuri+Hills+Madhapur-500081",https://psms.bits-pilani.ac.in/stationpreference/student/stationdetails/8893/114356
8577,Nirmal Bang - Ajmer  - Rajasthan,Finance and Mgmt,Ajmer,Rajasthan,India,Onsite,"201, A SQUARE,  OPP. PATEL MAIDAN, AJMER","https://www.google.com/maps/search/201,+A+SQUARE,++OPP.+PATEL+MAIDAN,+AJMER",https://psms.bits-pilani.ac.in/stationpreference/student/stationdetails/8577/114356
8578,"Nirmal Bang - Bhilwara, Rajasthan",Finance and Mgmt,Jaipur,Rajasthan,India,Onsite,"30, BADAL TEXTILE MARKET,  Bhilwara","https://www.google.com/maps/search/30,+BADAL+TEXTILE+MARKET,++Bhilwara",https://psms.bits-pilani.ac.in/stationpreference/student/stationdetails/8578/114356
8579,Nirmal Bang -Kota - Rajasthan,Finance and Mgmt,Jaipur,Rajasthan,India,Onsite,"8 WONDER VIEW,  BALLABHBARI, KOTA","https://www.google.com/maps/search/8+WONDER+VIEW,++BALLABHBARI,+KOTA",https://psms.bits-pilani.ac.in/stationpreference/student/stationdetails/8579/114356
8576,Nirmal Bang-Jaipur - Rajasthan,Finance and Mgmt,Jaipur,Rajasthan,India,Onsite,"201, SANGAM TOWER, CHURCH ROAD, JAIPUR 302001 303, SUN TOWER, GANDHI NAGAR, JAIPUR","https://www.google.com/maps/search/201,+SANGAM+TOWER,+CHURCH+ROAD,+JAIPUR+302001+303,+SUN+TOWER,+GANDHI+NAGAR,+JAIPUR",https://psms.bits-pilani.ac.in/stationpreference/student/stationdetails/8576/114356
7739,"Nitisara - Tech, Gurgaon",CSIS/IT,Gurgaon,Haryana,India,Online,"DLF Phase 3, Sector 24, Gurugram Haryana 122010","https://www.google.com/maps/search/DLF+Phase+3,+Sector+24,+Gurugram+Haryana+122010",https://psms.bits-pilani.ac.in/stationpreference/student/stationdetails/7739/114356
7738,Nitisara – Non Tech,CSIS/IT,Gurgaon,Haryana,India,Onsite,"DLF Phase 3, Sector 24, Gurugram, Haryana 122010 DLF Phase 3, Sector 24, Gurugram, Haryana 122010","https://www.google.com/maps/search/DLF+Phase+3,+Sector+24,+Gurugram,+Haryana+122010+DLF+Phase+3,+Sector+24,+Gurugram,+Haryana+122010",https://psms.bits-pilani.ac.in/stationpreference/student/stationdetails/7738/114356
4550,NIXI( National Internet Exchange of India),CSIS/IT,Delhi,Delhi,India,Onsite,"National Internet Exchange of India(NIXI),9 TH FLOOR, b wing Statesman House, 148, Barakhamba Road, New Delhi","https://www.google.com/maps/search/National+Internet+Exchange+of+India(NIXI),9+TH+FLOOR,+b+wing+Statesman+House,+148,+Barakhamba+Road,+New+Delhi",https://psms.bits-pilani.ac.in/stationpreference/student/stationdetails/4550/114356
4596,NLDC,CSIS/IT,New Delhi,Delhi,India,Onsite,"NRLDC, 18 Saheed Jeet Singh Sansanwal Marg Katwaria Sarai New Delhi - 110016","https://www.google.com/maps/search/NRLDC,+18+Saheed+Jeet+Singh+Sansanwal+Marg+Katwaria+Sarai+New+Delhi+-+110016",https://psms.bits-pilani.ac.in/stationpreference/student/stationdetails/4596/114356
6768,"NoQs Digital, Ahmedabad",CSIS/IT,Ahmedabad,Gujarat,India,Online,"NoQs Digital Pvt Ltd, Near Cafe Mocha, Ahmedabad, 380054 NoQs Digital Pvt Ltd, Near Cafe Mocha, Ahmedabad, 380054","https://www.google.com/maps/search/NoQs+Digital+Pvt+Ltd,+Near+Cafe+Mocha,+Ahmedabad,+380054+NoQs+Digital+Pvt+Ltd,+Near+Cafe+Mocha,+Ahmedabad,+380054",https://psms.bits-pilani.ac.in/stationpreference/student/stationdetails/6768/114356
8802,Northern Credit & Collection Business,Finance and Mgmt,New Delhi,Delhi,India,Onsite,"B-1/10, Community Center, JanakPuri, New Delhi-110058 New Delhi-110058","https://www.google.com/maps/search/B-1/10,+Community+Center,+JanakPuri,+New+Delhi-110058+New+Delhi-110058",https://psms.bits-pilani.ac.in/stationpreference/student/stationdetails/8802/114356
8805,Northern Credit & Collection Business-Dubai,Finance and Mgmt,Dubai,Dubai,United Arab Emirates,Onsite,- -,https://www.google.com/maps/search/-+-,https://psms.bits-pilani.ac.in/stationpreference/student/stationdetails/8805/114356
8610,Nouveau Labs Pvt Ltd,CSIS/IT,Bengaluru,Karnataka,India,Online,"GINSERV, JSS Campus, CA Site No : 1, HAL 3rd Stage, Behind Leela Palace, Kodihalli Bengaluru, Karnataka 560008 GINSERV, JSS Campus, CA Site No : 1, HAL 3rd Stage, Behind Leela Palace, Kodihalli Bengaluru, Karnataka 560008","https://www.google.com/maps/search/GINSERV,+JSS+Campus,+CA+Site+No+:+1,+HAL+3rd+Stage,+Behind+Leela+Palace,+Kodihalli+Bengaluru,+Karnataka+560008+GINSERV,+JSS+Campus,+CA+Site+No+:+1,+HAL+3rd+Stage,+Behind+Leela+Palace,+Kodihalli+Bengaluru,+Karnataka+560008",https://psms.bits-pilani.ac.in/stationpreference/student/stationdetails/8610/114356
6986,"NRLDC-National Regional Load Despatch Center, Grid-India",Electronics,Delhi,Delhi,India,Onsite,Delhi Delhi,https://www.google.com/maps/search/Delhi+Delhi,https://psms.bits-pilani.ac.in/stationpreference/student/stationdetails/6986/114356
8820,NTPC Limited,CSIS/IT,Korba,Chhattisgarh,India,Onsite,"Vikas Bhawan, Jamnipali, Distt Korba,  Chhattisgarh, 495450","https://www.google.com/maps/search/Vikas+Bhawan,+Jamnipali,+Distt+Korba,++Chhattisgarh,+495450",https://psms.bits-pilani.ac.in/stationpreference/student/stationdetails/8820/114356
8669,Ode Chem LLP,Health Care,Mumbai,Maharashtra,India,Onsite,"103, 1st Floor, Kunkuwadi CHSL, near Kunkuwadi Hanuman Mandir, Vile Parle East, Mumbai: 400057 103, 1st Floor, Kunkuwadi CHSL, near Kunkuwadi Hanuman Mandir, Vile Parle East, Mumbai: 400057","https://www.google.com/maps/search/103,+1st+Floor,+Kunkuwadi+CHSL,+near+Kunkuwadi+Hanuman+Mandir,+Vile+Parle+East,+Mumbai:+400057+103,+1st+Floor,+Kunkuwadi+CHSL,+near+Kunkuwadi+Hanuman+Mandir,+Vile+Parle+East,+Mumbai:+400057",https://psms.bits-pilani.ac.in/stationpreference/student/stationdetails/8669/114356
8641,Oh Bhaisahab Experiences,CSIS/IT,Dehradun,Uttarakhand,India,Onsite,"314, Flyover, near Mohkampur, Rajeshwari Puram, Jogiwala,  Dehradun, Uttarakhand 248005","https://www.google.com/maps/search/314,+Flyover,+near+Mohkampur,+Rajeshwari+Puram,+Jogiwala,++Dehradun,+Uttarakhand+248005",https://psms.bits-pilani.ac.in/stationpreference/student/stationdetails/8641/114356
4524,OnFinance AI - IT,CSIS/IT,Bangalore,Karnataka,India,Onsite,"OnFinance office ,8 th floor west wing, Raheja Tower, Mahatma Gandhi Road, Bengaluru, Karnataka- OnFinance office ,8 th floor west wing, Raheja Tower, Mahatma Gandhi Road, Bengaluru, Karnataka-","https://www.google.com/maps/search/OnFinance+office+,8+th+floor+west+wing,+Raheja+Tower,+Mahatma+Gandhi+Road,+Bengaluru,+Karnataka-+OnFinance+office+,8+th+floor+west+wing,+Raheja+Tower,+Mahatma+Gandhi+Road,+Bengaluru,+Karnataka-",https://psms.bits-pilani.ac.in/stationpreference/student/stationdetails/4524/114356
4632,ONGC,Mechanical,Surat,Gujarat,India,Onsite,"Hazira Plant, PO ONGC Nagar Surat-394518","https://www.google.com/maps/search/Hazira+Plant,+PO+ONGC+Nagar+Surat-394518",https://psms.bits-pilani.ac.in/stationpreference/student/stationdetails/4632/114356
8625,"ONGC, Ahmedabad",Infrastructure,Ahmedabad,Gujarat,India,Onsite,"CPF No.: 136245 2nd Floor, Tower-A, Deendayal Urja Bhavan 5, Nelson Mandela Marg,  Vasant Kunj, New Delhi-110 07","https://www.google.com/maps/search/CPF+No.:+136245+2nd+Floor,+Tower-A,+Deendayal+Urja+Bhavan+5,+Nelson+Mandela+Marg,++Vasant+Kunj,+New+Delhi-110+07",https://psms.bits-pilani.ac.in/stationpreference/student/stationdetails/8625/114356
8621,"ONGC, Dehradun",Infrastructure,Dehradun,Uttarakhand,India,Onsite,"Tel Bhawan, Dehradun - 248003, Uttarakhand Tel Bhawan, Dehradun - 248003, Uttarakhand","https://www.google.com/maps/search/Tel+Bhawan,+Dehradun+-+248003,+Uttarakhand+Tel+Bhawan,+Dehradun+-+248003,+Uttarakhand",https://psms.bits-pilani.ac.in/stationpreference/student/stationdetails/8621/114356
8620,"ONGC, Delhi",Infrastructure,New Delhi,Delhi,India,Onsite,"5, Nelson Mandela Marg, Vasant Kunj, New Delhi-110070 New Delhi-110070","https://www.google.com/maps/search/5,+Nelson+Mandela+Marg,+Vasant+Kunj,+New+Delhi-110070+New+Delhi-110070",https://psms.bits-pilani.ac.in/stationpreference/student/stationdetails/8620/114356
8545,OrbitArch,CSIS/IT,Delhi,Delhi,India,Online,Delhi Delhi,https://www.google.com/maps/search/Delhi+Delhi,https://psms.bits-pilani.ac.in/stationpreference/student/stationdetails/8545/114356
8575,Ornate Agencies Private Limited,Electronics,Delhi,Delhi,India,Onsite,"A-87, Okhla Industrial Area, Phase-II, Okhla Industrial Estate, South Delhi, New Delhi, Delhi, India, 110020 A-87, Okhla Industrial Area, Phase-II, Okhla Industrial Estate, South Delhi, New Delhi, Delhi, India, 110020","https://www.google.com/maps/search/A-87,+Okhla+Industrial+Area,+Phase-II,+Okhla+Industrial+Estate,+South+Delhi,+New+Delhi,+Delhi,+India,+110020+A-87,+Okhla+Industrial+Area,+Phase-II,+Okhla+Industrial+Estate,+South+Delhi,+New+Delhi,+Delhi,+India,+110020",https://psms.bits-pilani.ac.in/stationpreference/student/stationdetails/8575/114356
8793,Paradeep Phosphates Limited,Chemical,Mangalore,Karnataka,India,Onsite,Mangalore 	 Mangalore,https://www.google.com/maps/search/Mangalore+	+Mangalore,https://psms.bits-pilani.ac.in/stationpreference/student/stationdetails/8793/114356
8796,Paradeep Phosphates Limited  Goa,Chemical,Goa,Goa,India,Onsite,Goa Goa,https://www.google.com/maps/search/Goa+Goa,https://psms.bits-pilani.ac.in/stationpreference/student/stationdetails/8796/114356
8795,"Paradeep Phosphates Limited  PPL Township, Odisha",Chemical,"PPL Township, Odisha",Odisha,India,Onsite,"PPL Township, Odisha PPL Township, Odisha","https://www.google.com/maps/search/PPL+Township,+Odisha+PPL+Township,+Odisha",https://psms.bits-pilani.ac.in/stationpreference/student/stationdetails/8795/114356
8663,Pascal AI,CSIS/IT,Bengaluru,Karnataka,India,Onsite,"Second Floor, A Wing, of Indiqube Edge, building, situated at Khatha No. 571/630/6/4, (Sy No.6/4), Ambalipura Village, Outer Ring Road, Varthur Hobli, Bangalore 560103 Second Floor, A Wing, of Indiqube Edge, building, situated at Khatha No. 571/630/6/4, (Sy No.6/4), Ambalipura Village, Outer Ring Road, Varthur Hobli, Bangalore 560103","https://www.google.com/maps/search/Second+Floor,+A+Wing,+of+Indiqube+Edge,+building,+situated+at+Khatha+No.+571/630/6/4,+(Sy+No.6/4),+Ambalipura+Village,+Outer+Ring+Road,+Varthur+Hobli,+Bangalore+560103+Second+Floor,+A+Wing,+of+Indiqube+Edge,+building,+situated+at+Khatha+No.+571/630/6/4,+(Sy+No.6/4),+Ambalipura+Village,+Outer+Ring+Road,+Varthur+Hobli,+Bangalore+560103",https://psms.bits-pilani.ac.in/stationpreference/student/stationdetails/8663/114356
8565,Patratu Vidyut Utpadan Nigam Ltd.,CSIS/IT,Ramgarh,Jharkhand,India,Onsite,"PVUNL, Patratu, Ramgarh, Jharkhand 829119 PVUNL, Patratu, Ramgarh, Jharkhand 829119","https://www.google.com/maps/search/PVUNL,+Patratu,+Ramgarh,+Jharkhand+829119+PVUNL,+Patratu,+Ramgarh,+Jharkhand+829119",https://psms.bits-pilani.ac.in/stationpreference/student/stationdetails/8565/114356
8503,PerfectQA LLP,CSIS/IT,Ahmedabad,Gujarat,India,Onsite,"411, North Plaza, opp. Palladium Business Hub,  Motera, Ahmedabad, Gujarat 380005","https://www.google.com/maps/search/411,+North+Plaza,+opp.+Palladium+Business+Hub,++Motera,+Ahmedabad,+Gujarat+380005",https://psms.bits-pilani.ac.in/stationpreference/student/stationdetails/8503/114356
4387,Petasense Technologies Private Limited-Bangalore,CSIS/IT,Bengaluru,Karnataka,India,Onsite,"Bangalore Office Address: 91springboard, 3rd Floor, Padmavathi Complex, 80 Feet Rd, Koramangala 8th Block,  Koramangala, Bengaluru, Karnataka 560095","https://www.google.com/maps/search/Bangalore+Office+Address:+91springboard,+3rd+Floor,+Padmavathi+Complex,+80+Feet+Rd,+Koramangala+8th+Block,++Koramangala,+Bengaluru,+Karnataka+560095",https://psms.bits-pilani.ac.in/stationpreference/student/stationdetails/4387/114356
6673,Petasense Technologies Private Limited-Hyderabad,CSIS/IT,Hyderabad,Telangana,India,Onsite,"Hyderabad Office Address: 91springboard, LVS Arcade, 71, Hitech, Madhapur Road, Jubilee Enclave, HITEC City,  Hyderabad, Telangana 500081","https://www.google.com/maps/search/Hyderabad+Office+Address:+91springboard,+LVS+Arcade,+71,+Hitech,+Madhapur+Road,+Jubilee+Enclave,+HITEC+City,++Hyderabad,+Telangana+500081",https://psms.bits-pilani.ac.in/stationpreference/student/stationdetails/6673/114356
8572,Phaloudi Constructions and Infrastructure  PVT. LTD.,Infrastructure,Indore,Madhya Pradesh,India,Onsite,"203, Panama Tower Kanchan Baugh,  Geeta Bhawan Square Manorama Ganj, Indore 452001","https://www.google.com/maps/search/203,+Panama+Tower+Kanchan+Baugh,++Geeta+Bhawan+Square+Manorama+Ganj,+Indore+452001",https://psms.bits-pilani.ac.in/stationpreference/student/stationdetails/8572/114356
6904,Phodu Club - Non Tech,CSIS/IT,Panaji,Goa,India,Online,"Panaji, Goa Panaji, Goa","https://www.google.com/maps/search/Panaji,+Goa+Panaji,+Goa",https://psms.bits-pilani.ac.in/stationpreference/student/stationdetails/6904/114356
8884,"PIEDS online, Pilani",Finance and Mgmt,Pilani,Rajasthan,India,Online,Pilani Rajashthan,https://www.google.com/maps/search/Pilani+Rajashthan,https://psms.bits-pilani.ac.in/stationpreference/student/stationdetails/8884/114356
5417,"PIEDS, Jaipur",Finance and Mgmt,Pilani,Rajasthan,India,Onsite,"PIEDS BITS Pilani, Brick House, Pradhan Marg, Maliviya Nagar, Jaipur 302017 PIEDS BITS Pilani, Brick House, Pradhan Marg, Maliviya Nagar, Jaipur 302017","https://www.google.com/maps/search/PIEDS+BITS+Pilani,+Brick+House,+Pradhan+Marg,+Maliviya+Nagar,+Jaipur+302017+PIEDS+BITS+Pilani,+Brick+House,+Pradhan+Marg,+Maliviya+Nagar,+Jaipur+302017",https://psms.bits-pilani.ac.in/stationpreference/student/stationdetails/5417/114356
5418,"PIEDS, Pilani",Finance and Mgmt,Pilani,Rajasthan,India,Onsite,"Rakesh Kapoor innovation Center, BITS Pilani 333031 Rakesh Kapoor innovation Center, BITS Pilani 333031","https://www.google.com/maps/search/Rakesh+Kapoor+innovation+Center,+BITS+Pilani+333031+Rakesh+Kapoor+innovation+Center,+BITS+Pilani+333031",https://psms.bits-pilani.ac.in/stationpreference/student/stationdetails/5418/114356
8497,Pinnacle Industrial Controls Pvt Ltd,CSIS/IT,Mumbai,Maharashtra,India,Onsite,"Andheri Office- B206, Universal Business Park, Off Chandivali Farm Road, Andheri East, Mumbai 400072. Andheri Office- B206, Universal Business Park, Off Chandivali Farm Road, Andheri East, Mumbai 400072.","https://www.google.com/maps/search/Andheri+Office-+B206,+Universal+Business+Park,+Off+Chandivali+Farm+Road,+Andheri+East,+Mumbai+400072.+Andheri+Office-+B206,+Universal+Business+Park,+Off+Chandivali+Farm+Road,+Andheri+East,+Mumbai+400072.",https://psms.bits-pilani.ac.in/stationpreference/student/stationdetails/8497/114356
8835,Pixaflip Technologies Pvt Ltd,CSIS/IT,Pune,Maharashtra,India,Online,"Science & Technology Park, SPPU Campus,  GaneshKhind Road, Pune 411007","https://www.google.com/maps/search/Science+&+Technology+Park,+SPPU+Campus,++GaneshKhind+Road,+Pune+411007",https://psms.bits-pilani.ac.in/stationpreference/student/stationdetails/8835/114356
4610,"PNT Robotics & Automation Solutions,LLP",CSIS/IT,Mumbai,Maharashtra,India,Onsite,"Unit 107, 1st Floor, Infinity Business Park Behind K.V.Pendharkar college, MIDC phase-I, Dombivli East","https://www.google.com/maps/search/Unit+107,+1st+Floor,+Infinity+Business+Park+Behind+K.V.Pendharkar+college,+MIDC+phase-I,+Dombivli+East",https://psms.bits-pilani.ac.in/stationpreference/student/stationdetails/4610/114356
4398,Pockvue Solutions Pvt. Ltd - Tech,Finance and Mgmt,Bengaluru,Karnataka,India,Onsite,"CRE Spacez, #1, 2  nd Floor, 14th Main Rd, Sector 5,  HSR Layout, Bengaluru, Karnataka 560102","https://www.google.com/maps/search/CRE+Spacez,+#1,+2++nd+Floor,+14th+Main+Rd,+Sector+5,++HSR+Layout,+Bengaluru,+Karnataka+560102",https://psms.bits-pilani.ac.in/stationpreference/student/stationdetails/4398/114356
8756,Power Finance Corp. Ltd.,Electronics,New Delhi,Delhi,India,Onsite,"POWER FINANCE CORP LTD. Urjanidhi 1, Barakhamba Ln, near Metro Bhawan, Fire Brigade Lane, Connaught Place, New Delhi, Delhi 11000","https://www.google.com/maps/search/POWER+FINANCE+CORP+LTD.+Urjanidhi+1,+Barakhamba+Ln,+near+Metro+Bhawan,+Fire+Brigade+Lane,+Connaught+Place,+New+Delhi,+Delhi+11000",https://psms.bits-pilani.ac.in/stationpreference/student/stationdetails/8756/114356
8797,Pranesh Deep Tech Solutions,Electronics,Hyderabad,Telangana,India,Onsite,Hyderabad Hyderabad,https://www.google.com/maps/search/Hyderabad+Hyderabad,https://psms.bits-pilani.ac.in/stationpreference/student/stationdetails/8797/114356
8626,Pratham Education Foundation-Bengaluru,Finance and Mgmt,Bengaluru,Karnataka,India,Onsite,"Flat G101, Nanda Deep Apartments, 87, Kumarakrupa Rd, Kumara Park East,  Seshadripuram, Bengaluru, Karnataka 560001.","https://www.google.com/maps/search/Flat+G101,+Nanda+Deep+Apartments,+87,+Kumarakrupa+Rd,+Kumara+Park+East,++Seshadripuram,+Bengaluru,+Karnataka+560001.",https://psms.bits-pilani.ac.in/stationpreference/student/stationdetails/8626/114356
8628,Pratham Education Foundation-Koppal,Finance and Mgmt,Koppal,Karnataka,India,Onsite,"Sri Rama nilaya, H-NO= 8-2-143/1, Simpi Linganna Road ,  KOPPAL. 583231","https://www.google.com/maps/search/Sri+Rama+nilaya,+H-NO=+8-2-143/1,+Simpi+Linganna+Road+,++KOPPAL.+583231",https://psms.bits-pilani.ac.in/stationpreference/student/stationdetails/8628/114356
8627,Pratham Education Foundation-Mysuru,Finance and Mgmt,Mysore,Karnataka,India,Onsite,"#2684/1,6th Main, 13th Cross Rd, Vani Vilas Mohalla,  Mysuru, Karnataka","https://www.google.com/maps/search/#2684/1,6th+Main,+13th+Cross+Rd,+Vani+Vilas+Mohalla,++Mysuru,+Karnataka",https://psms.bits-pilani.ac.in/stationpreference/student/stationdetails/8627/114356
4507,Preto Tooling Systems,Mechanical,Hyderabad,Telangana,India,Onsite,"94-3, C.L.E.E.P, Gandhinagar,  Balanagar","https://www.google.com/maps/search/94-3,+C.L.E.E.P,+Gandhinagar,++Balanagar",https://psms.bits-pilani.ac.in/stationpreference/student/stationdetails/4507/114356
8614,PRIMESTEELTECH IND PVT LTD,Infrastructure,Mumbai,Maharashtra,India,Onsite,"Shop No. 6, 'B' Wing, Tuljai CHS LTD., Kasturba Cross Road No. 4, Borivali (E), Mumbai- 400 066. Shop No. 6, 'B' Wing, Tuljai CHS LTD., Kasturba Cross Road No. 4, Borivali (E), Mumbai- 400 066.","https://www.google.com/maps/search/Shop+No.+6,+'B'+Wing,+Tuljai+CHS+LTD.,+Kasturba+Cross+Road+No.+4,+Borivali+(E),+Mumbai-+400+066.+Shop+No.+6,+'B'+Wing,+Tuljai+CHS+LTD.,+Kasturba+Cross+Road+No.+4,+Borivali+(E),+Mumbai-+400+066.",https://psms.bits-pilani.ac.in/stationpreference/student/stationdetails/8614/114356
8832,Prismberry Technologies Private Limited,CSIS/IT,Noida,Uttar Pradesh,India,Onsite,"B-10, 1st Floor, Block B, Noida Sector 3 Noida, Uttar Pradesh 201301","https://www.google.com/maps/search/B-10,+1st+Floor,+Block+B,+Noida+Sector+3+Noida,+Uttar+Pradesh+201301",https://psms.bits-pilani.ac.in/stationpreference/student/stationdetails/8832/114356
8629,Promark Techsolutionspvt ltd,Manufacturing,Morinda,Punjab,India,Onsite,"Promark Techsolutionspvt ltd , ludhiana highway (NH - 95 ),  morinda , Dist Ropar - punjab -140413","https://www.google.com/maps/search/Promark+Techsolutionspvt+ltd+,+ludhiana+highway+(NH+-+95+),++morinda+,+Dist+Ropar+-+punjab+-140413",https://psms.bits-pilani.ac.in/stationpreference/student/stationdetails/8629/114356
8719,PS-I Entrepreneurship track - Aha Automotive Innovations LLP - Non Tech,CSIS/IT,Jaipur,Rajasthan,India,Onsite,Jaipur -,https://www.google.com/maps/search/Jaipur+-,https://psms.bits-pilani.ac.in/stationpreference/student/stationdetails/8719/114356
8718,PS-I Entrepreneurship track - Aha Automotive Innovations LLP - Tech,CSIS/IT,Jaipur,Rajasthan,India,Onsite,Jaipur -,https://www.google.com/maps/search/Jaipur+-,https://psms.bits-pilani.ac.in/stationpreference/student/stationdetails/8718/114356
8701,PS-I Entrepreneurship track - Aithri Tech Private Limited - Non Tech,Others,Jaipur,Rajasthan,India,Onsite,"Aithri Tech Pvt Ltd Office #234,235 2nd floor, Metropolis Tower, Ajmer Road,  Purani Chungi, Jaipur 302019","https://www.google.com/maps/search/Aithri+Tech+Pvt+Ltd+Office+#234,235+2nd+floor,+Metropolis+Tower,+Ajmer+Road,++Purani+Chungi,+Jaipur+302019",https://psms.bits-pilani.ac.in/stationpreference/student/stationdetails/8701/114356
8700,PS-I Entrepreneurship track - Aithri Tech Private Limited - Tech,Others,Jaipur,Rajasthan,India,Onsite,"Aithri Tech Pvt Ltd Office #234,235 2nd floor, Metropolis Tower, Ajmer Road, Purani Chungi Jaipur 302019","https://www.google.com/maps/search/Aithri+Tech+Pvt+Ltd+Office+#234,235+2nd+floor,+Metropolis+Tower,+Ajmer+Road,+Purani+Chungi+Jaipur+302019",https://psms.bits-pilani.ac.in/stationpreference/student/stationdetails/8700/114356
8697,PS-I Entrepreneurship track - Akshar Bharati,Others,Pune,Maharashtra,India,Onsite,Baner Pune Baner Pune,https://www.google.com/maps/search/Baner+Pune+Baner+Pune,https://psms.bits-pilani.ac.in/stationpreference/student/stationdetails/8697/114356
8751,PS-I Entrepreneurship track - Apollyon Dynamics - Non Tech,CSIS/IT,Hyderabad,Telangana,India,Onsite,Hyderabad Telangana,https://www.google.com/maps/search/Hyderabad+Telangana,https://psms.bits-pilani.ac.in/stationpreference/student/stationdetails/8751/114356
